title	author	WD_signature	storage	publisher	year	pages
Różnice indywidualne studentów jako problem pedagogiczny nauczycieli akademickich	Czarnecki, Kazimierz (1933- ). 		magazyn	"Oficyna Wydawnicza ""Humanitas"". Wyższa Szkoła Humanitas, "	2012	126
Regionalizm ekonomiczny Azji Wschodniej : jedno spojrzenie - różne wymiary	Drelich-Skulska, Bogusława. 	HC460.5 .D74 2012		Wydawnictwo Uniwersytetu Ekonomicznego, 	2012	230
Teksty o sztuce	De Chirico, Giorgio (1888-1978). 	N68.3 .D4165 2012	magazyn	Wydawnictwa Uniwersytetu Warszawskiego [etc.], cop. 	2012	170
Złota nić	De Wohl, Louis (1903-1961). 		magazyn	Wydawnictwo Diecezjalne i Drukarnia, 	2012	436
Księga gier i zabaw : na podwórku, w plenerze, w domu	Drake, Jane (1954- ). 		magazyn	Wydawnictwo Jedność, cop. 	2012	177
Wybór i rozeznanie woli Bożej : droga do pełni życia	Drobot, Paweł (1971- ). 		magazyn	Homo Dei, cop. 	2012	197
Sieci teleinformatyczne w procesie dowodzenia komponentem wojsk lądowych	Dela, Piotr. 		magazyn	Akademia Obrony Narodowej, 	2012	307
Jak wychować szczęśliwe dzieci	Eichelberger, Wojciech (1944- ). 	HQ772 .E34 2012		Wydawnictwo Zwierciadło, cop. 	2012	169
Saving truth from paradox	Field, Hartry H. (1946- ). 	BC199.P2 F54 2012		University Press, 	2012	406
Biznes po prostu : następny krok	Czarnecki, Leszek (1962- ). 	HD2746.5 .C95 2012		Muza, 	2012	350
Tajemnica Misty Bay	Del Ponte, Giovanni (1965- ). 		magazyn	Wydawnictwo Zielona Sowa, cop. 	2012	205
Svata Hora : kult maryjny i działalność duszpasterska w sanktuarium na Svatej Horze	Drzazga, Krzysztof (1975- ). 	BT660.P75 D79 2012		Wydawnictwo Polihymnia, 	2012	315
Determinanty readaptacji społecznej skazanych	Fidelus, Anna. 	HV9715.7 .F53 2012		Wydawnictwo Uniwersytetu Kardynała Stefana Wyszyńskiego, 	2012	573
Innovation for sustainable aviation in a global environment : proceedings of the Sixth European Aeronautics Days, Madrid, 30 March - 1 April 2011	European Aeronautics Days (6 ; 2011 : Madryt). 		magazyn	IOS Press, cop. 	2012	488
Negocjacje w procesie rozszerzenia Unii Europejskiej na Wschód : uwarunkowania, aktorzy, przebieg	Curyło, Barbara. 	JN15 .C87 2012		Wydawnictwo Adam Marszałek, cop. 	2012	430
Biochemia żywności : (metody, zadania i testy)	Dziuba, Jerzy (1944-2014). 		magazyn	Wydawnictwo Uniwersytetu Warmińsko-Mazurskiego, cop. 	2012	299
Torebka i kalosze, czyli Nowy klub jogi	Edge, Lucy. 	PR6105.D44 H36165 2012		Zysk i S-ka Wydawnictwo, cop. 	2012	315
Języki słowiańskie	Dalewska-Greń, Hanna. 		magazyn	Wydawnictwo Naukowe PWN, 	2012	665
Grünberg	Fedorowicz, Krzysztof (1970- ). 	PG7206.E45 G78 2012		Wydawnictwo Libron, 	2012	148
Wiersze	Dalkiewicz, Jacek. 		magazyn	Warszawska Firma Wydawnicza, 	2012	110
Apelacja w postępowaniu cywilnym	Ereciński, Tadeusz (1946- ). 	KKP1822 .E76 2012		LexisNexis, 	2012	255
Doznać cudu? : opowieść Trudy Rosenberg	Fedorowicz, Hania M. 		magazyn	Smak Słowa, 	2012	132
Osobne drzewo	Czarnota, Jerzy (1944- ). 		magazyn	Wydawnictwo Adam Marszałek, cop. 	2012	177
Zieleń cmentarzy w krajobrazie wsi Dolnego Śląska	Dębicz, Regina. 		magazyn	Wydawnictwo Uniwersytetu Przyrodniczego, cop. 	2012	311
Transnarodowe sieci terytorialne w Europie	Dumała, Hanna. 	JZ5332 .D86 2012		Wydawnictwo Uniwersytetu Marii Curie-Skłodowskiej, 	2012	459
Mroczna symfonia	Feehan, Christine. 	PS3606.E36 D38165 2012		Wydawnictwo Amber, 	2012	333
Kształtowanie cywilizacji europejskiej. T. 2, Europa nowożytna i współczesna	Dębski, Jerzy (geografia). 	CB203 .D44 2008 t.2		Wydawnictwo Wyższej Szkoły Finansów i Zarządzania, 	2012	446
Dama w opałach	Doornebos, Karen. 	PS3604.O67 D44165 2012		Społeczny Instytut Wydawniczy Znak, 	2012	453
Łazienki Królewskie w Warszawie : cztery pory roku = Royal Łazienki in Warsaw : the four seasons	Czapliński, Czesław (1953- ). 	DK4641.L39 C93 2012		Muzeum Łazienki Królewskie, 	2012	151
Modelowanie odbicia promieniowania optycznego	Domke, Konrad (1950-2015). 		magazyn	Wydawnictwo Politechniki Poznańskiej, 	2012	128
Rozumienie pragmatycznych aspektów wypowiedzi przez dzieci ze specyficznym zaburzeniem językowym SLI	Czaplewska, Ewa. 	RJ506.S68 C92 2012	magazyn	"""Harmonia Universalis"", "	2012	348
Wpływ parametrów procesu wytwarzania na mikrostrukturę i własności spiekanych stali samohartujących	Faryj, Katarzyna. 		magazyn	Wydawnictwa AGH, 	2012	197
Bernard z Wąbrzeźna i jego czasy	Dębiński, Józef (1951- ). 		magazyn	[s.n.], 	2012	103
Niemodlin : monografia miasta i gminy	Domska, Janina (1946- ). 	DK4800.N536 D653 2012		Wydawnictwo MS, cop. 	2012	223
Bratnie dusze	Cygler, Hanna (1960- ). 	PG7203.Y45 B73 2012		"Dom Wydawniczy ""Rebis"", "	2012	331
Wykształcenie, praca, przedsiębiorczość Polaków : raport z badania ludności realizowanego w 2012 roku w ramach III edycji projektu Bilans Kapitału Ludzkiego	Czarnik, Szymon. 		magazyn	Polska Agencja Rozwoju Przedsiębiorczości, 	2012	112
Klasztor Norbertanek w Imbramowicach : studia i materiały	Dębowska, Maria (1954- ). 		magazyn	Miejska i Powiatowa Biblioteka Publiczna, 	2012	148
Przełom : bitwa pod Gorlicami-Tarnowem 1915	DiNardo, Richard Louis (1956- ). 	D557.G6 D56165 2012		Dom Wydawniczy REBIS, cop. 	2012	271
Z Górzycy do Tokio : wspomnienia Edwarda Czernika	Czernik, Edward (1940- ). 		magazyn	Drukarnia Sonar, [	2012	143
Czarna kobieta, biały kraj	Dirie, Waris (1967- ). 	HQ1795.Z75 D57165 2012		Świat Książki, 	2012	280
Opowieści Hipogryfinów	Dombrowska, Joanna. 			Novae Res - Wydawnictwo Innowacyjne, cop. 	2012	129
China's uncertain future	Domenach, Jean-Luc (1945- ). 	DS779.4 .D6613 2012		Columbia University Press, 	2012	192
Tekst polifoniczny jako przedmiot tłumaczenia literackiego	Dębska, Karolina. 	PN241 .D43 2012	magazyn	Instytut Lingwistyki Stosowanej Uniwersytetu Warszawskiego, 	2012	202
Cyber warfare and the laws of war	Dinniss, Heather Harrison. 	KZ6718 .D56 2012		University Press, 	2012	331
Tworzenie dokumentacji technicznej w programie EPLAN : przykłady praktyczne	Dominik, Ireneusz. 	TA174 .D667 2012		DELTA  J.A. JAGŁA, 	2012	188
Mroczny obrońca	Feehan, Christine. 	PS3606.E36 D367165 2012		Wydawnictwo Amber, 	2012	334
The history of land use in Mongolia : the thirteenth century to the present	Endicott, Elizabeth. 	HD920.8 .E53 2012		Palgrave Macmillan, 	2012	228
Genealogia psychiczna	Dębicka, Elżbieta (1885-1954). 	CS879.A2 D43 2012		Wydawnictwo Uniwersytetu Wrocławskiego, 	2012	160
Rozważania o wierze : z zagadnień teologii duchowości	Dajczer, Tadeusz (1931-2009). 		magazyn	Edycja Świętego Pawła, cop. 	2012	261
12 kroków z Jezusem : osobista historia uzdrowienia	Daphne K. 		magazyn	Wydawnictwo Serafin, 	2012	405
Bibliografia katechetyczna 2001-2010	Czekalski, Ryszard (1962- ). 	BX921 .C953 2012		Wydawnictwo Uniwersytetu Kardynała Stefana Wyszyńskiego, 	2012	507
Implikacje etyczne teologii stworzenia	Czekalski, Rafał (1970- ). 		magazyn	Warszawskie Towarzystwo Teologiczne, 	2012	214
Świat duszy	Danowska, Nina. 		magazyn	Wydawnictwo Black Unicorn, 	2012	123
Ugoda w polskim prawie cywilnym	Dulęba, Daniel. 	KKP1769 .D85 2012		LexisNexis Polska, 	2012	253
Who lives, who dies, who decides?: abortion, neonatal care, assisted dying, and capital punishment	Ekland-Olson, Sheldon (1944- ). 	QH332 .E47 2012		Routledge, 	2012	424
Dieta zrzuć 5 kilo (i więcej)	Danziger, Lucy S. 	RM222.2 .D36165 2012		Amber, 	2012	447
Czynniki rozwoju i zróżnicowanie funkcji turystycznej na obszarach wiejskich w Polsce	Durydiwka, Małgorzata. 	G155.P7 D87 2012	magazyn	Uniwersytet Warszawski. Wydział Geografii i Studiów Regionalnych, 	2012	376
Polska bibliografia turkologiczna	Emiroğlu, Öztürk (1965- ). 	DR417 .E45 2012		Wydawnictwo AGADE, 	2012	182
Wyścig na orbitę	D'Antonio, Michael (1955- ). 	TL796.5.U5 D36165 2012		Prószyński i S-ka, 	2012	382
Wprowadzenie do teorii anten i szyków antenowych	Dębicki, Piotr (1941-2017). 	TK7871.6 .D43 2012		Akademia Morska w Gdyni, 	2012	208
Grudzień 1970 : geneza, przebieg, konsekwencje	Eisler, Jerzy (1952- ). 	DK4440 .E358 2012	magazyn	Instytut Pamięci Narodowej. Komisja Ścigania Zbrodni przeciwko Narodowi Polskiemu, 	2012	522
Sponsoring : klucz nowoczesnego marketingu	Datko, Marek. 	HD59.35 .D38 2012		Wydawnictwo Placet, 	2012	526
Bóg dał nam czas próby : wspomnienia z lat 1918-1935	Donimirska, Maria (1890-1942). 		magazyn	Towarzystwo Miłośników Ziemi Sztumskiej, 	2012	126
Wielka mistyfikacja : czy Jezus i św. Paweł to jedna osoba?	Einhorn, Lena (1954- ). 		magazyn	Wydawnictwo Czarna Owca, 	2012	283
Multi-normed spaces	Dales, Harold Garth (1944- ). 		magazyn	Instytut Matematyczny PAN, 	2012	165
Instytucjonalne formy opieki i pomocy społecznej dla dzieci, młodzieży, dorosłych	Ejsmont, Marek. 		magazyn	Ateneum - Szkoła Wyższa, 	2012	140
Prawo rzymskie : tablice chronologiczne, łacińskie maksymy prawnicze, rozbudowane o odniesienia do współczesności, kazusy z komentarzami	Dajczak, Wojciech (1962- ). 		magazyn	Wydawnictwo Od.Nowa, cop. 	2012	200
Zintegrowane systemy zarządzania jakością, środowiskiem i bezpieczeństwem pracy	Ejdys, Joanna. 	TS156.6 .E4 2012		Oficyna Wydawnicza Politechniki Białostockiej, 	2012	229
The nature of the contract in reasoning of civilian jurists	Dajczak, Wojciech (1962- ). 	K840 .D35 2012		Wydawnictwo Naukowe UAM, 	2012	192
The political economy of terrorism	Enders, Walter (1948- ). 	HV6431 .E54 2012		Cambridge University Press, 	2012	390
Historia świata w sztuce : jak czytać...	Febbraro, Flavio. 	N8210 .F43165 2012		Towarzystwo Autorów i Wydawców Prac Naukowych UNIVERSITAS, cop. 	2012	388
Literatura i terapia	Czernianin, Wiktor (1952- ). 	RC489.B48 C94 2012		"""Smak Słowa"", "	2012	144
Pełnia serca	Eldredge, John (1960- ). 	BV4501.3 .E526165 2012		Wydawnictwo Polskiej Prowincji Dominikanów W drodze, 	2012	244
Spacerem po historii muzyki. T. 1	Erhardt, Ludwik (1934- ). 	ML160 .E847 2012 t.1	magazyn	Me-Komp, 	2012	335
Rozwijanie zainteresowań i zdolności matematycznych uczniów klas I-III szkoły podstawowej : poradnik dla nauczyciela	Fechner-Sędzicka, Iwona. 	QA135.6 .F43 2012		Ośrodek Rozwoju Edukacji, 	2012	112
Atlas neuroanatomii i neurofizjologii Nettera	Felten, David L. 	QM451 .F45165 2012		Elsevier Urban & Partner, cop. 	2012	430
Gaz składowiskowy : źródło energii odnawialnej	Dudek, Jerzy. 		magazyn	Instytut Nafty i Gazu, 	2012	150
Portrety z historią...	Czapliński, Czesław (1953- ). 	CT199 .C93 2012		Wydawnictwo Zwierciadło, 	2012	237
Fizyka : mechanika i fale	Dittmar-Wituski, Adam. 	QC21.3 .D57 2012		Wydawnictwo Uczelniane Uniwersytetu Technologiczno-Przyrodniczego, 	2012	211
Finanse behawioralne : zachowania inwestorów i rynku	Czerwonka, Monika. 	HG4515.15 .C96 2012		Oficyna Wydawnicza Szkoła Główna Handlowa, 	2012	206
Activus Aspectus: Polska - Rosja : miejsce instytucji kultury w rozwoju społeczności lokalnych po przełomie ustrojowym	Dunaeva, Viktoriâ. 	HN539.5.C6 D86 2012	magazyn	"Stowarzyszenie ""Rosyjski dom"", "	2012	159
Dokąd nam iść wypada? : Mesjanizm Polski a prawda dziejów	Dzieduszycki, Wojciech (1848-1909). 	D16.8 .D96 2012	magazyn	Ośrodek Myśli Politycznej, [	2012	662
Technologia form offsetowych	Czichon, Herbert (1934- ). 		magazyn	Oficyna Wydawnicza Politechniki Warszawskiej, 	2012	277
Za Jezusem miłosiernym	Dłutowski, Michał (1974- ). 		magazyn	Apostolicum, 	2012	124
Uzdrowiciel : Jan Paweł II	Englisch, Andreas (1963- ). 	BX1378.5 .E644165 2012		Wydawnictwo WAM - Księża Jezuici, 	2012	278
40 dni i Ty : trudne, ale piękne człowieczeństwo	Fal, Andrzej (1964- ). 		magazyn	"Wydawnictwo ""Bernardinum"", "	2012	400
Liczę z Pitagorasem : podręcznik do matematyki dla klasy 4	Durydiwka, Stanisław. 		magazyn	"Oficyna Wydawniczo-Poligraficzna ""Adam"", "	2012	240
Hammerstein, czyli Upór : niemiecka historia	Enzensberger, Hans Magnus (1929- ). 	DD247.H26 E59165 2012		Świat Książki, 	2012	350
Elementy teorii i praktyki podatków majątkowych : poszukiwanie ładu w opodatkowaniu nieruchomości w Polsce z perspektywy przedsiębiorców oraz jednostek samorządu terytorialnego	Felis, Paweł (1969- ). 	HJ4368.7 .F45 2012		Szkoła Główna Handlowa - Oficyna Wydawnicza, 	2012	407
Ćwiczenia na fortepian : leczące dolegliwości fizyczne związane z grą na instrumencie i wyrabiające naturalną, funkcjonalną technikę pianistyczną	Feuchtwanger, Peter (1930-2016). 	MT220 .F48165 2012	magazyn	Wydawnictwo Uniwersytetu Jana Kochanowskiego, 	2012	189
Brda i Kanał Bydgoski	Dudek, Krzysztof (1962- ). 	TG95.P72 B73 2012		Związek Mostowców Rzeczypospolitej Polskiej, 	2012	227
Wpływ obserwowanych i prognozowanych warunków klimatycznych na stabilność drzewostanów górskich w Beskidzie Śląskim	Durło, Grzegorz Benedykt. 	SD390.6.P6 D87 2012		Wydawnictwo Uniwersytetu Rolniczego, 	2012	163
Zarządzanie kryzysowe w teorii i praktyce. Cz. 1, Pojęcia - zagrożenia - system	Falecki, Janusz. 	HV551.5.P7 F35 2012 t.1		Wyższa Szkoła Handlowa im. Bolesława Markowskiego w Kielcach, cop. 	2012	150
Podatek rolny, podatek leśny : komentarz	Etel, Leonard (1960- ). 	KKP3572.A37 E84 2012	magazyn	Lex a Wolters Kluwer business, 	2012	307
W drodze do utraconej Itaki : prasa, książki i czytelnictwo na szlaku Samodzielnej Brygady Strzelców Karpackich (1940-1942) oraz Armii Polskiej na Wschodzie i 2. Korpusu (1941-1946)	Czarnik, Oskar Stanisław (1937- ). 	Z365.3 .C924 2012	magazyn	Biblioteka Narodowa, 	2012	515
Znani i zasłużeni z gminy Borzęcin : wszędzie można zrobić coś dobrego	Dojka, Iwona. 		magazyn	Gmina, 	2012	191
Informacyjne i perswazyjne funkcje reklamy społecznej w świetle antropologii i aksjologii	Dudziak, Arkadiusz. 	HD59.3 .D83 2012		Wydawnictwo Uniwersytetu Warmińsko-Mazurskiego, cop. 	2012	287
Religia : zeszyt ćwiczeń dla klasy zerowej	Doppke, Jan (1956- ). 		magazyn	Wydawnictwo Adventus, [	2012	101
Wybrane formy organizacyjne działań podmiotów uprawnionych w zakresie bezpieczeństwa wewnętrznego państwa. Cz. 1, Środki przymusu bezpośredniego i broń palna	Dyduch, Leszek. 	KKP3010 .W93 2012 t.1		Wyższa Szkoła Zarządzania i Prawa im. Heleny Chodkowskiej, 	2012	188
Selected topics in discrete mathematics	Fałda, Beata (ekonometria). 		magazyn	Wydawnictwo KUL, 	2012	204
Postfutbol : antropologia piłki nożnej	Czubaj, Mariusz (1969- ). 	GV943.9.A57 C98 2012		Wydawnictwo Naukowe Katedra, 	2012	287
Separatyzm etniczny w dobie praw człowieka - nowe wyzwanie dla państwa narodowego i społeczności międzynarodowej	Czubocha, Krzysztof. 	JC327 .C98 2012		Wydawnictwo Adam Marszałek, 	2012	315
Bolesławiec słowem i obrazem malowany	Dudek, Kamilla. 	DK4800.B65 D84 2012		Novae Res - Wydawnictwo Innowacyjne, cop. 	2012	130
Modern : szlakiem cieszyńskiej moderny	Czernek, Przemysław (1985- ). 	NA1455.P62 C563 2012		Urząd Miejski. Wydział Promocji i Informacji, 	2012	120
"Lot ku wolności : wspomnienia pilota 308 Dywizjonu ""Krakowskiego"""	De Nahlik, A. J. (1920-2008). 	D786 .D42165 2012		Oficyna Wydawnicza Rytm, 	2012	327
Pojęcie państwa i procesy państwowotwórcze we współczesnym prawie międzynarodowym	Czubocha, Krzysztof. 	KZ4002 .C98 2012		Wydawnictwo Adam Marszałek, 	2012	259
Wracajcie w gościnę : rodzina Dudziaków i Kuterebów po mieczu i kądzieli	Dudziak, Józef Stanisław (1947- ). 		magazyn	Sonar, 	2012	200
Hobbit : niezwykła podróż. Kronika 1, Sztuka tworzenia filmu	Falconer, Daniel. 		magazyn	Amber, 	2012	198
Sześć cnót mniejszych	Domeracki, Piotr. 	BJ1526 .D66 2012		Wydawnictwo Naukowe Uniwersytetu Mikołaja Kopernika, 	2012	234
Kapliczki i krzyże przydrożne w Polsce	Czerwiński, Tomasz (1950- ). 	NB1793.P7 C94 2012		Sport i Turystyka Muza, 	2012	378
Afrodyzjak zewnętrzny albo Traktat o biczyku : dziełko medyczno-filozoficzne z dodaniem rozprawy o wszystkich środkach podniecania miłosnych rozkoszy oraz z katalogiem afrodyzjaków	Doppet, François Amédée (1753-1800). 		magazyn	Wydawnictwo Słowo/Obraz Terytoria, 	2012	132
Męskie zgromadzenia zakonne i stowarzyszenia życia apostolskiego na prawie papieskim	Daniluk, Mirosław (1936- ). 	BX2420 .D35 2012		Wydawnictwo Księży Sercanów DEHON, dr. 	2012	189
Pelplin w fotografii Cezarego Dębowskiego	Dębowski, Cezary. 	NA5955.P62 P453 2012		"Wydawnictwo ""Bernardinum"", "	2012	115
Pałac Kazimierza Karasia	Domińczyk, Małgorzata. 		magazyn	[s.n.], 	2012	196
Przepis życia	Donohue, Meg. 	PS3604.O565 H69165 2012		Prószyński Media, 	2012	382
Młode i stare	Częstochowski, Ryszard (1957- ). 		magazyn	[Związek Literatów Polskich. Oddział Bydgosko-Toruński], 	2012	129
Módlmy się psalmami. Ks. 1, (Psalmy 1-41)	Deja, Ludwika. 		magazyn	Wydawnictwo Emmanuel, cop. 	2012	492
Tajemnica niebieskiego kufra	Dion, Lise. 		magazyn	Prószyński i S-ka, 	2012	206
Dumała	Dumała, Piotr (1956- ). 	NX571.P64 D862 2012		Wydawnictwo Słowo/Obraz Terytoria, cop. 	2012	279
Ślicznotka	Faleiro, Sonia. 	HQ240.B6 F36165 2012		Wydawnictwo Naukowe PWN, cop. 	2012	253
Pieśni miłosne = Cântece de iubire	Diudea, Mircea V. (1950- ). 	PC840.414.I93 C36 2012		Wydawnictwo Amaltea, 	2012	113
Ziemne budowle hydrotechniczne na terenach sejsmicznych i parasejsmicznych w Polsce : wybrane aspekty modelowania i obliczeń	Dulińska, Joanna. 	TC181 .D85 2012		Wydawnictwo PK, 	2012	178
Sklepy internetowe : jak złapać w sieci e-konsumentki i e-konsumentów	Feldy, Marzena. 	HF5548.32 .F45 2012	magazyn	Wolters Kluwer Polska, 	2012	320
Wyprawa do Ameryki : dzieło sceniczne w trzech aktach napisane przez Anastazego Podhalskiego : quotlibet złożony z żywych obrazów miasta Łodzi	Dłużniewski, Wiktor (1818-1873). 		magazyn	eConn, 	2012	128
Indeks jakości współpracy : obraz współpracy między organizacjami pozarządowymi a administracją publiczną	Dudkiewicz, Marek. 	HD2769.2.P7 D88 2012		Ministerstwo Pracy i Polityki Społecznej, [	2012	178
Matki - mężne czy szalone? = Mothers - courageous or crazy?	Dzbeńska-Karpińska, Marta (1969- ). 	HQ759 .D93 2012		Centrum Myśli Jana Pawła II, 	2012	118
Szlachta ziemi chełmskiej do połowy XVI wieku	Czarnecki, Włodzimierz (historia). 	HT653.P7 C96 2012		Instytut Badań nad Dziedzictwem Kulturowym Europy, 	2012	434
Najem 2012 : opodatkowanie przychodu z wynajmu : kiedy wynajmujący jest podatnikiem VAT, rozliczenie przychodów i kosztów, najem jako odrębne źródło przychodów, najem jako działalność gospodarcza	Dyszy, Wiesława. 	KKP3589.3.L43 D98 2012		Wszechnica Podatkowa, 	2012	168
Sześćdziesiąt lat minęło...	Engel, Zbigniew (1933-2013). 	TJ159.7.P7 E54 2012		Wydawnictwo Naukowe Instytutu Technologii Eksploatacji Państwowego Instytutu Badawczego, 	2012	224
Pomieszanie z poplątaniem	Dorska, Liliana. 		magazyn	Warszawska Firma Wydawnicza, 	2012	123
Biała edukacja : wybrane zagadnienia antystresowej koncepcji ochrony zdrowia w praktyce edukacyjnej	Dytfeld, Józef. 		magazyn	Ośrodek Doskonalenia Nauczycieli, 	2012	161
Bestie ludzkiej wyobraźni	Czerwiński, Zbigniew. 	QL50 .C94 2012		"""Śląsk"" Wydawnictwo Naukowe, "	2012	193
Zasady oceny działalności gospodarczej przedsiębiorstw	Engelhardt, Juliusz. 	HD36 .E58 2012		CeDeWu.pl Wydawnictwa Fachowe, 	2012	259
Myths, lies and oil wars	Engdahl, Frederick William. 	HD9560.6 .E546 2012		Edition.Engdahl, 	2012	225
GórFanka : na himalajskiej ścieżce	Czerwińska, Anna (1949- ). 	GV199.92.C94 A342 2012		Annapurna, 	2012	253
Budownictwo ludowe w Polsce	Czerwiński, Tomasz (1950- ). 	NA8206.P6 C94 2012		Sport i Turystyka - Muza, 	2012	322
Religia : zeszyt ćwiczeń dla klasy pierwszej szkoły podstawowej	Doppke, Jan (1956- ). 		magazyn	Wydawnictwo Adventus, [	2012	114
Second duals of measure algebras	Dales, Harold Garth (1944- ). 		magazyn	Instytut Matematyczny PAN, 	2012	121
Przyjaciele i czarodziejski klucz	Depta, Justyna Ewelina (1990- ). 		magazyn	Novae Res - Wydawnictwo Innowacyjne, cop. 	2012	237
Dokumenty klasztoru oo. kamedułów z Pożajścia w Państwowym Archiwum Historycznym w Tbilisi : katalog	Czamańska, Ilona (1951- ). 		magazyn	Wydawnictwo Nauka i Innowacje, 	2012	158
Teleogłupianie : o zgubnych skutkach oglądania telewizji (nie tylko przez dzieci)	Desmurget, Michel. 	PN1992.6 .D47165 2012		Wydawnictwo Czarna Owca, 	2012	379
Filtracja powietrza wlotowego do silników spalinowych pojazdów mechanicznych	Dziubak, Tadeusz. 		magazyn	Wojskowa Akademia Techniczna, 	2012	351
Bez wzajemności  : Żydzi-Niemcy 1743-1933	Elon, Amos (1926-2009). 	DS134.25 .E46165 2012		Wydawnictwo Nisza, 	2012	486
J. B. Fischer von Erlach : architecture as theater in the Baroque era	Dotson, Esther Gordon (1918-2009). 	NA1011.5.F57 D67 2012		Yale University Press, cop. 	2012	170
Princes of the Mughal Empire, 1504-1719	Faruqui, Munis Daniyal (1967- ). 	DS461 .F37 2012		Cambridge University Press, 	2012	348
Sanktuarium Matki Bożej Pocieszenia w Łazówku	Czumaj, Zenon. 		magazyn	Kuria Diecezjalna w Drohiczynie], 	2012	230
Berlin : [przewodnik + atlas	Czupryna, Joanna Maria. 	DD859 .C97 2012		ExpressMap Polska, 	2012	312
Odważni	Evans, Nicholas (1950- ). 	PS3555.V253 B73165 2012		Wydawnictwo Albatros A. Kuryłowicz, 	2012	413
Niebo to miejsce na ziemi	Edwardson, Åke (1953- ). 	PT9876.15.D93 H56165 2012		Wydawnictwo Czarna Owca, 	2012	453
24 Festiwal Polskiego Malarstwa Współczesnego, Szczecin 2012	Festiwal Polskiego Malarstwa Współczesnego (24 ; 2012 ; Szczecin). 	ND955.P6 F47 2012		Przedsiębiorstwo Produkcyjno-Handlowe Zapol Dmochowski, Sobczyk, [	2012	230
Dalajlama w pracy : jak stawić czoło wyzwaniom	Dornieden, Claudia. 	BF481 .D67165 2012		Wydawnictwo Zwierciadło, 	2012	145
Kamienny żagiel	Edwardson, Åke (1953- ). 	PT9876.15.D93 S44165 2012		Wydawnictwo Czarna Owca, 	2012	499
Z fizyką w przyszłość : podręcznik dla szkół ponadgimnazjalnych : zakres rozszerzony. Cz. 1	Fiałkowska, Maria. 		magazyn	ZamKor, 	2012	295
Prawo handlowe dla ekonomistów	Dąbek, Paweł (1970- ). 	KKP920 .P73297 2012	magazyn	Lex a Wolters Kluwer business, 	2012	271
Nadciąga burza	Dibben, Damian. 	PR6104.I27 S76165 2012		Egmont Polska, 	2012	327
Jak słuchać aby słyszeć : szkice z metodyki kształcenia słuchu. T. 1	Dobrowolska-Marucha, Danuta. 	MT35 .D63 2012 t.1	magazyn	Uniwersytet Muzyczny Fryderyka Chopina, [	2012	230
Tradycja jest wyzwaniem : z prymasem Czech, arcybiskupem Pragi Dominikiem Duką OP	Duka, Dominik Jaroslav (1943- ). 	BX4705.D864 A5165 2012		Wydawnictwo Polskiej Prowincji Dominikanów - W drodze, 	2012	197
Musings of the rebellious emigrant	Czekajewski, Jan (1934- ). 		magazyn	MJW Graphics, cop. 	2012	307
35 lat budowania mostów : o posłudze duszpasterskiej księdza Bogdana Kicingera w Babicach (1977-2012)	Czogalik, Kornelia. 		magazyn	[Drukarnia i Wydawnictwo św. Krzyża], 	2012	134
Manuskrypt Jana Żeglarza	Dudziński, Andrzej (1959- ). 	PG7204.U444 M36 2012		Wydawnictwo Bukowy Las, cop. 	2012	516
Podatek od towarów i usług w 2012 roku. Cz. 2, Zbiór przepisów wykonawczych	Dworniak, Jan. 	KKP3633 .A28 2012 t.2		P.U.H.P. Sanpollac, 	2012	232
Poszukiwacze szczęścia	Doshi, Tishani (1975- ). 	PR9499.4.D67 P57165 2012		Świat Książki, 	2012	317
Jerzy Grabowski : artist and the universe = artysta i uniwersum	Dudzik, Sebastian (1972- ). 	N7255.P63 G72334 2012		Andzelm Gallery, cop. 	2012	245
Miód lipowy i dobrobyt w Ameryce	Dziedzic, Franciszek (1927- ). 		magazyn	Parafia Rzymskokatolicka pw. Matki Bożej Wspomożenia Wiernych, 	2012	134
IMP³rove: europejski projekt o trwałym oddziaływaniu : 50 historii sukcesu związanych z zarządzaniem innowacjami	Engel, Kai. 		magazyn	Polska Agencja Rozwoju Przedsiębiorczości, 	2012	199
Wobec metafizyki : filozofia - sztuka - film : antologia	Festiwal Filmu Filozoficznego (6 ; 2011 ; Kraków). 	PN1995.9.P42 F46 2012		Wydawnictwo WAM, 	2012	473
Poznać i zrozumieć Jezusa. T. 1, Tyś jest Mesjasz : na podstawie Ewangelii według św. Marka (1,1-8,30)	Cyran, Włodzimierz (1965- ). 		magazyn	"Wspólnota Przymierza Rodzin ""Mamre"", "	2012	334
Stan i perspektywy rewizji finansowej : XIII Doroczna Konferencja Audytingu Krajowej Izby Biegłych Rewidentów, Jachranka 24-26 października 2012 : materiały pokonferencyjne	Doroczna Konferencja Audytingu Krajowej Izby Biegłych Rewidentów (13 ; 2012 ; Jachranka). 	HF5667 .D67 2012		Krajowa Izba Biegłych Rewidentów, 	2012	303
Rola polityki spójności Unii Europejskiej w usuwaniu regionalnych nierówności gospodarczych : wnioski dla Polski	Dorożyński, Tomasz. 	HT395.E8 D67 2012		Wydawnictwo Uniwersytetu Łódzkiego, 	2012	242
Śmiertelnie proste rozwiązanie	Ellory, Roger Jon (1965- ). 	PR6105.L65 S55165 2012		Wydawnictwo Dolnośląskie, cop. 	2012	557
Opodatkowanie usług budowlanych 2012	Dyszy, Wiesława. 	KKP3634 .D97 2012		Wszechnica Podatkowa, 	2012	180
Wespazjan : kat Rzymu	Fabbri, Robert (1961- ). 	PR6106.A237 V46165 2012		"Dom Wydawniczy ""Rebis"", "	2012	402
Vixen 03	Cussler, Clive (1931-2020). 	PS3553.U75 V59165 2012		Wydawnictwo Amber, 	2012	318
Historia doktryn politycznych i prawnych do schyłku XX wieku	Dubel, Lech (1948- ). 	JA81 .D83 2012		LexisNexis Polska, 	2012	540
Moja wiara	Dziedzina Wiwer, Andrzej (1945- ). 		magazyn	Wydawnictwo Astraia, 	2012	144
Filozofia dziejów Immanuela Kanta	Dziuda, Karol (1985- ). 	D16.8 .D97 2012		Wydawnictwo Black Unicorn, 	2012	158
Królestwo	Cussler, Clive (1931-2020). 	PS3553.U75 K56165 2012		Wydawnictwo Amber, 	2012	350
Ulgi podatkowe dla firm i osób fizycznych	Czajkowska-Matosiuk, Katarzyna. 		magazyn	INFOR Ekspert, 	2012	128
Jak upolować faceta : po pierwsze dla pieniędzy	Evanovich, Janet. 	PS3555.V2126 O5165 2012		Fabryka Słów, 	2012	343
Z dziejów przemysłu Siemianowic Śląskich	Derus, Małgorzata. 		magazyn	Urząd Miasta, 	2012	111
Przyroda z pomysłem : poradnik nauczyciela : klasa 4 : szkoła podstawowa	Depczyk, Urszula. 		magazyn	Wydawnictwa Szkolne i Pedagogiczne, 	2012	199
Ostrogi : style Nietzschego	Derrida, Jacques (1930-2004). 	B3317 .D47165 2012		Wydawnictwo Officyna, 	2012	100
Ostre koło : globalna kultura	Edwards, Andrew (1980- ). 		magazyn	Vesper, 	2012	144
